<?xml version="1.0" encoding="UTF-8"?>
<!DOCTYPE panel SYSTEM "ejercicio3.dtd">
<panel>
    <nombre_aeropuerto>JFK</nombre_aeropuerto>
    <fecha>20/12/2013</fecha>
    <vuelos>
        <vuelo codigo="V22" estado="R">
            <origen>New York</origen>
            <destino>Chicago</destino>
            <salida>09:30</salida>
            <llegada>11:30</llegada>
        </vuelo>
        <vuelo codigo="V23" estado="C">
            <origen>New York</origen>
            <destino>Miami</destino>
            <salida>10:15</salida>
            <llegada>11:15</llegada>
        </vuelo>
    </vuelos>
</panel>
